{"algorithm":"ed25519","components":["fixture-component"],"contracts":["fixture.contract"],"environments":["sha256:bbbbbbbbbbbbbbbbbbbbbbbbbbbbbbbbbbbbbbbbbbbbbbbbbbbbbbbbbbbbbbbb"],"extensions":{},"keyid":"sha256:6a3803d5f059902a1c6dafbc9ba4729212f7caac08634cc3ae76b27529f03827","predicate_types":["https://mncs.dev/predicate/conformance-result/v0.2"],"public_key":"gTl3Dqh9F19Wo1Rmw0x+zMuNipG07jeiXfYPW4/Js5Q=","roles":["evaluator"],"schema_version":"0.2"}
