{"algorithm":"ed25519","components":["fixture-component"],"contracts":["fixture.contract"],"environments":["sha256:bbbbbbbbbbbbbbbbbbbbbbbbbbbbbbbbbbbbbbbbbbbbbbbbbbbbbbbbbbbbbbbb"],"extensions":{},"keyid":"sha256:34750f98bd59fcfc946da45aaabe933be154a4b5094e1c4abf42866505f3c97e","predicate_types":["https://mncs.dev/predicate/conformance-result/v0.2"],"public_key":"iojj3XQJ8ZX9UtstPLpdcspnCb8dlBIb83SIAbQPb1w=","roles":["evaluator"],"schema_version":"0.2"}
